{
  "schema_version": "1.0.0",
  "policy_id": "a2-organic-stereochemistry-and-carbonyl-reduction-2026-10-29",
  "confirmation_basis": "Direct teacher instructions on 2026-10-29: keep every Paper 4 question in A2; put organic chirality/stereoisomerism and ordinary aldehyde/ketone reduction in chapter 11, retain coordination stereoisomers in chapter 6, classify actual amide reductions by chapter 9.",
  "questions": [
    {
      "question_id": "cie-9701-s18-41-q8-a",
      "material_fingerprint": "542376acfa555109f8e47e8e0af2aa3fadabc38f1c1a22a6cb94685c8dc4a821",
      "before_teaching_fingerprint": "3fe7464da1068c5e824b88feff0c79023710a4fbbc39033d9342d87d91173cea",
      "required_chapters": [
        11
      ],
      "knowledge_tags": [
        "organic.stereochemistry"
      ],
      "reason": "Locate the chiral carbon in the supplied abscisic acid structure. Reinterpret the existing source-bound task/context/MS judgment under the teacher-confirmed A2 chapter 11 rule. The source, scoring and coordinates are unchanged; all non-classification gates remain in force."
    },
    {
      "question_id": "cie-9701-s18-41-q8-b",
      "material_fingerprint": "7db502bf2b600a4cacb414921c16d3257466c957de968e0c068a3806d879941b",
      "before_teaching_fingerprint": "1231f9985ec77907075e5b94af2a358a8a6fc48b1b41e854fa3e6942202f0654",
      "required_chapters": [
        11
      ],
      "knowledge_tags": [
        "organic.carbonyl-reduction",
        "synthesis.single-step"
      ],
      "reason": "Infer the molecular formula after NaBH4 reduces the supplied abscisic-acid ketone to an alcohol; this is not amide reduction and does not require carboxylic-acid reduction. Reinterpret the existing source-bound task/context/MS judgment under the teacher-confirmed A2 chapter 11 rule. The source, scoring and coordinates are unchanged; all non-classification gates remain in force."
    },
    {
      "question_id": "cie-9701-s18-41-q9-b",
      "material_fingerprint": "d76ddba4179b09a9c1d5b3dfd04efea0f07f19f2e2a7f586aa5cd21fde1c50de",
      "before_teaching_fingerprint": "1cbd98f418f3f694532f68cf566c17e930fc964344dbcb5ffa32cad01038e02c",
      "required_chapters": [
        11
      ],
      "knowledge_tags": [
        "organic.stereochemistry"
      ],
      "reason": "Explain noradrenaline stereoisomerism from its chiral carbon; its amine name is background rather than a tested amine reaction. Reinterpret the existing source-bound task/context/MS judgment under the teacher-confirmed A2 chapter 11 rule. The source, scoring and coordinates are unchanged; all non-classification gates remain in force."
    },
    {
      "question_id": "cie-9701-s18-42-q7-e",
      "material_fingerprint": "5dfdc1b9bdf13e8f278c0deb8101e2882ffb22815fc8330d45e5c3d21fb2e498",
      "before_teaching_fingerprint": "9d438660732814225ee8dbf78f4acc0839a60c66911ac67c10cf27e81e0d6d9d",
      "required_chapters": [
        11
      ],
      "knowledge_tags": [
        "organic.stereochemistry"
      ],
      "reason": "Draw the two three-dimensional valine mirror images with the supplied R group; no amino-acid reaction is required. Reinterpret the existing source-bound task/context/MS judgment under the teacher-confirmed A2 chapter 11 rule. The source, scoring and coordinates are unchanged; all non-classification gates remain in force."
    },
    {
      "question_id": "cie-9701-s18-42-q8-b",
      "material_fingerprint": "6add00dba5d46e962af8b4fbb7b47f009be95a7c7d4ad6379d38a9036be57371",
      "before_teaching_fingerprint": "4a2778e7ce560ecea058008e67f2539563a8eb38da16b28895d10aafa0a4f5e6",
      "required_chapters": [
        11
      ],
      "knowledge_tags": [
        "organic.stereochemistry"
      ],
      "reason": "Count chiral carbons in the supplied calcitriol structure; the separate later NMR tasks are not needed. Reinterpret the existing source-bound task/context/MS judgment under the teacher-confirmed A2 chapter 11 rule. The source, scoring and coordinates are unchanged; all non-classification gates remain in force."
    },
    {
      "question_id": "cie-9701-s18-42-q8-c",
      "material_fingerprint": "345b8b0af5c970729667c5bc2b33aebd5a50649d3aec3ec61c6b1a6a9f1f7c78",
      "before_teaching_fingerprint": "5d8f2df77db6cd4a96af7e3ec962976e653baa6168228e8445b59f7237e93add",
      "required_chapters": [
        11
      ],
      "knowledge_tags": [
        "organic.stereochemistry"
      ],
      "reason": "Count geometrical isomers of the supplied calcitriol structure; the task does not require NMR interpretation. Reinterpret the existing source-bound task/context/MS judgment under the teacher-confirmed A2 chapter 11 rule. The source, scoring and coordinates are unchanged; all non-classification gates remain in force."
    },
    {
      "question_id": "cie-9701-s18-43-q8-a",
      "material_fingerprint": "2d3eb6e8c3b522b1e7493554963332ea0e84963fd149b49be4e29c1e23ee99bc",
      "before_teaching_fingerprint": "19f9179a2e4fa4980fc55153def67eefd29c1cf8a31fe56c135db39e71387ef6",
      "required_chapters": [
        11
      ],
      "knowledge_tags": [
        "organic.stereochemistry"
      ],
      "reason": "Locate the chiral carbon in this variant supplied abscisic acid structure. Reinterpret the existing source-bound task/context/MS judgment under the teacher-confirmed A2 chapter 11 rule. The source, scoring and coordinates are unchanged; all non-classification gates remain in force."
    },
    {
      "question_id": "cie-9701-s18-43-q8-b",
      "material_fingerprint": "92b2817f7ef3d429301387fba19fa389b74ccc8120bfde9ace0fe2ffeb7a337e",
      "before_teaching_fingerprint": "5638b1aabe04f3ba5a020bca4782d1c005638858ab81a568a79f8e66f3b62fe5",
      "required_chapters": [
        11
      ],
      "knowledge_tags": [
        "organic.carbonyl-reduction",
        "synthesis.single-step"
      ],
      "reason": "Infer the molecular formula after ketone-to-alcohol NaBH4 reduction of this variant supplied abscisic acid, leaving its acid group unchanged. Reinterpret the existing source-bound task/context/MS judgment under the teacher-confirmed A2 chapter 11 rule. The source, scoring and coordinates are unchanged; all non-classification gates remain in force."
    },
    {
      "question_id": "cie-9701-s18-43-q9-b",
      "material_fingerprint": "82229be9525d7109a022993856daee3cd0daead223c3a20fb6c6ac7a2c33f67a",
      "before_teaching_fingerprint": "85ad25aafb35dcf0f43784dbc6c1535a30c240bc1d136d82652eee96ae1c427a",
      "required_chapters": [
        11
      ],
      "knowledge_tags": [
        "organic.stereochemistry"
      ],
      "reason": "Explain this variant noradrenaline stereoisomerism from the chiral carbon, without requiring amine chemistry. Reinterpret the existing source-bound task/context/MS judgment under the teacher-confirmed A2 chapter 11 rule. The source, scoring and coordinates are unchanged; all non-classification gates remain in force."
    },
    {
      "question_id": "cie-9701-s19-41-q8-e-i",
      "material_fingerprint": "2f9cd3efade9b7f7088d40e0a2f9a4ee611faf7dfce2ca2d0e75c1ce34359a41",
      "before_teaching_fingerprint": "5b480de0a6f486ff5c797668c403c2817bd8c22ce155400f224e1441d70c0446",
      "required_chapters": [
        11
      ],
      "knowledge_tags": [
        "organic.stereochemistry"
      ],
      "reason": "Define a chiral centre as a carbon bonded to four different groups; no separate NMR result is needed. Reinterpret the existing source-bound task/context/MS judgment under the teacher-confirmed A2 chapter 11 rule. The source, scoring and coordinates are unchanged; all non-classification gates remain in force."
    },
    {
      "question_id": "cie-9701-s19-42-q7-c",
      "material_fingerprint": "6a5c91dc75f34f19cc3a26ea6c0874a2ff476dd0dc0799914d25cfd7bf8fda36",
      "before_teaching_fingerprint": "772bbd053d5479923e6f1e226e88d4bafc1440f24c666d65bd67fca9633552e0",
      "required_chapters": [
        11
      ],
      "knowledge_tags": [
        "organic.stereochemistry"
      ],
      "reason": "Draw the alanine three-dimensional non-superimposable mirror-image pair from the given structural formula. Reinterpret the existing source-bound task/context/MS judgment under the teacher-confirmed A2 chapter 11 rule. The source, scoring and coordinates are unchanged; all non-classification gates remain in force."
    },
    {
      "question_id": "cie-9701-s19-43-q8-e-i",
      "material_fingerprint": "e5ff539c1d669f9366d7f2d439f511b9b509203bcc66a8d21d75b4dc3876f0af",
      "before_teaching_fingerprint": "ebfc45866ad442a1e887c799b84ab2fd2f78a5e4bede46bfb69230532e489194",
      "required_chapters": [
        11
      ],
      "knowledge_tags": [
        "organic.stereochemistry"
      ],
      "reason": "Define a chiral centre in this variant, independently of the preceding structure-analysis questions. Reinterpret the existing source-bound task/context/MS judgment under the teacher-confirmed A2 chapter 11 rule. The source, scoring and coordinates are unchanged; all non-classification gates remain in force."
    },
    {
      "question_id": "cie-9701-m20-42-q4-a-ii",
      "material_fingerprint": "ea64fa732b43f45530514efee6982196c24cabbc6fa9845d391fe4a70e8d5c4e",
      "before_teaching_fingerprint": "ccf1c529a931092ebe1d317add81d6c65c81123c02b824b9705428c79e97c754",
      "required_chapters": [
        11
      ],
      "knowledge_tags": [
        "organic.stereochemistry"
      ],
      "reason": "Count chiral carbons on the supplied F structure; the surrounding amide topic does not make hydrolysis knowledge necessary for this leaf. Reinterpret the existing source-bound task/context/MS judgment under the teacher-confirmed A2 chapter 11 rule. The source, scoring and coordinates are unchanged; all non-classification gates remain in force."
    },
    {
      "question_id": "cie-9701-m20-42-q6-c-i",
      "material_fingerprint": "a3a1e8ee6e226584b132ae476fef51e98304472c4ad13f828e600891cb1c9082",